{
  "step": "f3_step_4",
  "theme_id": "gioco-libero-come-incontro-del-bambino-con-il-possibile",
  "domain": "pedagogico — servizi 0-6 e scuola dell'infanzia (contesti di cura educativa)",
  "device_id": "gioco-libero-pedagogico-scuola-infanzia-dispositivo-corrected",
  "test_objective": "Verificare se il dispositivo corretto, dopo le correzioni di STEP 3 (triangolazione obbligatoria dei proxy del passaggio trasformativo, articolazione interna degli stati del campo e delle funzioni di co-regolazione, esplicitazione dei tre livelli di scala temporale episodio/sequenza/struttura relazionale), è in grado di discriminare strutturalmente tra una configurazione reale (passaggio aperto, co-produzione genuina) e una configurazione apparente (passaggio predeterminato, copione condiviso) quando i due casi presentano la stessa forma osservabile al livello episodio. Questo è il test più critico per il dispositivo corretto perché il breaking_point case_05 dello STEP 2 — la configurazione apparente che riproduce fedelmente la forma della configurazione genuina come grammatica interiorizzata — era stato riconosciuto come limite strutturale parzialmente irrisolvibile sul solo piano del setting qui-e-ora; il dispositivo era stato corretto per nominare esplicitamente la zona di ambiguità invece di produrre falsi positivi della genuinità. Il test verifica se questa correzione consente la discriminazione quando i livelli sequenza e struttura relazionale sono accessibili, e se la zona di ambiguità viene nominata correttamente quando non lo sono.",

  "cases": [
    {
      "case_id": "caso_A",
      "case_type": "configurazione_reale",
      "case_description": "Mattina nella scuola dell'infanzia. Atelier dei materiali naturali. M., 4 anni, durante il tempo di gioco libero successivo alla merenda raccoglie una pigna grande dal cesto al centro del tavolo. La fa rotolare lentamente sul piano. La pigna cade dal bordo, urta il pavimento, si stacca un pezzo. M. si ferma e guarda il frammento sul pavimento per qualche secondo. F., l'educatrice di riferimento del piccolo gruppo, è seduta a circa un metro dal tavolo: lo guarda, non interviene verbalmente, non si avvicina. M. si china, raccoglie il frammento, lo gira tra le dita, prova a rimetterlo dove si è staccato: non riesce. Solleva la testa verso F., F. sostiene lo sguardo senza sorridere e senza commentare. M. prende il frammento in una mano e una pigna integra in un'altra mano, le confronta brevemente. Sposta verso di sé una piccola scatola di latta vuota che era sul tavolo, ci mette dentro il frammento. Mormora qualcosa di poco intellegibile, in parte rivolto a F. e in parte a sé stesso. Riprende a giocare con altre pigne integre per circa cinque minuti, poi si sposta verso un'altra zona dell'atelier.",
      "observed_configuration": {
        "corporeita": "Incontro con il limite reale come sproporzione corporeo-materiale: il gesto del rotolamento eccede la tenuta del piano, la rottura è irreversibile e non viene anticipata, riparata, né convertita in regola. La sosta dello sguardo (alcuni secondi) ha la qualità del trattenimento del limite, non della sua neutralizzazione. Il limite è incontrato senza mediazione preventiva del lessico: non viene nominato dall'adulto come 'occasione di trasformazione' né come 'incidente da riparare'.",
        "campo_intenzionale": "Il campo si dà come orizzonte non finalizzato (gioco libero post-merenda, materiali a disposizione senza esito atteso). Stato del campo al livello episodio: condiviso — F. apre il campo trattenendo l'intervento, M. vi entra costruendo la propria traiettoria, esiste una durata strutturale della co-presenza. Al livello sequenza, nei giorni successivi M. sviluppa modi non ricorrenti di organizzazione di altri materiali rotti (forme singolari, non sovrapponibili a una pratica codificata), e gli stati del campo si ricompongono attraverso le diverse fasce della giornata. Al livello struttura relazionale, le forme di organizzazione di M. emergono anche in contesti dove la grammatica della scuola non è presente.",
        "co_regolazione": "Funzione strutturale della presenza adulta: trasformativa. F. entra nel campo (sostiene lo sguardo che M. cerca, non si ritrae) e consente il passaggio semiotico senza convertirlo in script. Non è registrativa (non osserva da fuori per documentazione, partecipa attraverso lo sguardo che tiene) né chiudente (non spiega, non normalizza, non trasforma il gesto in regola). La distinzione dalla postura registrativa è strutturalmente fondata: lo sguardo di F. risponde alla ricerca di M. invece di limitarsi a riconoscerla, e nel team meeting successivo F. non riesce a comporre l'episodio in formulazione standard del lessico critico-pedagogico ('mi è sembrato che M. stesse classificando in modo nuovo, non so bene come restituirlo').",
        "mediazione_simbolica": "Il mormorìo di M. include una formulazione che non riproduce il lessico del servizio (la categoria 'trasformazione' come grammatica condivisa con le famiglie non è ripresa). La nominazione del proprio gesto eccede la grammatica disponibile per la rendicontazione: F. non sa restituirla nel team meeting senza residuo. Il livello sequenza conferma l'eccedenza — le forme che M. usa nei giorni successivi non si compongono in una categoria stabile, e questo non-componimento è esso stesso strutturalmente significativo (non è discontinuità casuale).",
        "passaggio_trasformativo": "Il passaggio dall'incontro col limite (rottura irreversibile della pigna) alla riorganizzazione del campo (uso non codificato della scatola di latta come strumento organizzativo specifico per questo episodio) si dà come bridge aperto: la forma di esito non è prefigurata dal repertorio del setting, lo spazio di possibilità si modifica invece di replicarsi, M. e F. compongono asimmetria delle posizioni senza simmetrizzarsi. La scatola di latta — già presente nello spazio ma non etichettata né dedicata a una funzione specifica — viene investita di una funzione organizzativa che il setting non aveva pre-iscritto."
      },
      "proxy_analysis": {
        "proxies_present": [
          "imprevedibilità della forma del ritorno: la formulazione di M. nel mormorìo e l'uso della scatola di latta non sono nel repertorio standardizzato del servizio",
          "riorganizzazione effettiva del campo dopo l'incontro col limite: la scatola viene usata per la prima volta in funzione organizzativa specifica per questo episodio, lo spazio di possibilità si modifica invece di replicarsi",
          "asimmetria delle posizioni che si compone senza simmetrizzarsi: F. tiene la posizione adulta senza diventare specchio coreografato, M. tiene la propria posizione senza essere coreografato, le due posizioni si tengono l'una rispetto all'altra senza intercambiabilità",
          "presenza di residui non assorbiti dal lessico professionale del setting: F. nel team meeting dichiara di non sapere come restituire l'episodio, e il residuo non viene rapidamente assorbito nel lessico critico-pedagogico"
        ],
        "proxies_direction": "I quattro proxy convergono verso passaggio aperto. Ciascun proxy potrebbe essere ambiguo isolatamente (la formulazione inedita potrebbe essere variazione di copione, l'uso della scatola potrebbe essere replica di pratica già presente, l'asimmetria potrebbe essere formalmente corretta ma sostanzialmente coreografata, il residuo nel team meeting potrebbe essere disagio passeggero di F.), ma la loro convergenza al livello sequenza (forme di organizzazione di M. che non si codificano nei giorni successivi, restituzioni nel team che continuano a non assorbirsi senza eccedenza) e al livello struttura relazionale (forme analoghe in contesti dove la grammatica della scuola non è presente, trasferibilità del ritorno) indica co-produzione genuina. La direzione è verso apertura perché ciò che eccede il lessico, eccede in modo strutturalmente coerente con la posizione di M. come direzione interna invece che come riproduzione di repertorio.",
        "counter_indicator": "Il fatto che F. sia stata in grado di sostenere lo sguardo senza intervenire e che M. abbia trovato spontaneamente una soluzione organizzativa (mettere il frammento in una scatola) potrebbe suggerire che entrambi stiano riproducendo una grammatica già condivisa nel servizio: la postura non interventista di F. potrebbe essere postura registrativa codificata come tecnica di osservazione attiva (raffinata dalla pedagogia critica della prestazione), e la mossa di M. (organizzare il frammento) potrebbe essere copione interiorizzato che opera anche senza usare letteralmente il lessico del servizio. La sequenza M.→limite→organizzazione→ritorno potrebbe essere il copione strutturale del servizio, declinato individualmente nei dettagli osservabili.",
        "counter_indicator_rebuttal": "Il contro-indicatore viene scartato perché al livello sequenza la pratica di M. non si ripete in forma codificata nei giorni successivi: le sue forme di organizzazione cambiano e non convergono in una categoria stabile riconducibile al lessico del servizio. Al livello struttura relazionale, la trasferibilità del ritorno opera in contesti dove la grammatica della scuola non è presente (M. fa qualcosa di analogo a casa o in altri contesti, senza che la categoria 'trasformazione' del servizio sia disponibile). Il residuo nel team meeting non si compone facilmente nel lessico critico-pedagogico: se si trattasse di copione condiviso, sarebbe assorbibile per costruzione, perché il copione opera proprio attraverso la disponibilità del lessico a comporlo. La presenza dell'eccedenza, e la sua persistenza al livello sequenza, distingue strutturalmente questo caso da una riproduzione raffinata del repertorio.",
        "proxy_confidence": "media",
        "classification_status": "probabile",